{
  "schemaVersion": 1,
  "source": {
    "taskCatalogPath": "task-catalog.json",
    "taskCatalogSha256": "e24b110f699d6c36ba64acffa5f0940be4edc6d4cb0dff29dd2856c6bffa075e"
  },
  "foundationPhaseId": "PHASE-01",
  "phases": [
    {
      "id": "PHASE-01",
      "order": 1,
      "name": "完整数据基线与全量 Base",
      "outcome": "完整 init.sql 一次覆盖全部固定能力和低代码通用模型，真实 MySQL 校验后只运行一次 MyBatis-Plus 全量 Base 生成。",
      "dependsOn": [],
      "capabilityIds": ["CAP-PRODUCT-DELIVERY"]
    },
    {
      "id": "PHASE-02",
      "order": 2,
      "name": "身份、系统、权限与运行基础",
      "outcome": "用户可安全登录，创建进入系统租户，后台维护组织权限，并具备统一契约、审计和作业基础。",
      "dependsOn": ["PHASE-01"],
      "capabilityIds": ["CAP-IDENTITY", "CAP-SYSTEM-TENANCY", "CAP-AUTHORIZATION", "CAP-AUDIT", "CAP-PLATFORM-FOUNDATION", "CAP-BACKGROUND-JOBS"]
    },
    {
      "id": "PHASE-03",
      "order": 3,
      "name": "低代码建模与业务记录闭环",
      "outcome": "管理员从系统页面完成模块字段页面规则发布，普通用户在统一 Web 壳中新建编辑、归档、转化和共享真实记录。",
      "dependsOn": ["PHASE-02"],
      "capabilityIds": ["CAP-LOWCODE-DEFINITION", "CAP-RECORD-RUNTIME", "CAP-UI-RUNTIME"]
    },
    {
      "id": "PHASE-04",
      "order": 4,
      "name": "流程、应用与协同能力",
      "outcome": "Flow、应用桥梁、任务日志、待办消息、文件及模块导入导出形成可用的跨能力闭环。",
      "dependsOn": ["PHASE-03"],
      "capabilityIds": ["CAP-FLOW", "CAP-APPLICATION", "CAP-WORK", "CAP-NOTIFICATION", "CAP-FILE", "CAP-DATA-EXCHANGE"]
    },
    {
      "id": "PHASE-05",
      "order": 5,
      "name": "AI、统计 KPI 与打印",
      "outcome": "AI 在权限和人工确认下连接系统，仪表盘统计 KPI 可解释，模块记录可按权限打印。",
      "dependsOn": ["PHASE-04"],
      "capabilityIds": ["CAP-AI", "CAP-ANALYTICS", "CAP-PRINT"]
    },
    {
      "id": "PHASE-06",
      "order": 6,
      "name": "运维安全与统一响应式 Hardening",
      "outcome": "部署升级备份密钥观测具备真实操作闭环，同一 Vue 应用通过完整移动断点、触控与可访问性验收。",
      "dependsOn": ["PHASE-05"],
      "capabilityIds": ["CAP-OPERATIONS-SECURITY"]
    }
  ],
  "defaultEstimates": {
    "design": 30,
    "database": 60,
    "base-generation": 15,
    "backend-manage": 60,
    "frontend": 45,
    "integration-test": 15,
    "operations": 90
  },
  "capabilityEstimateFactors": [
    {"capabilityId": "CAP-SYSTEM-TENANCY", "percent": 125},
    {"capabilityId": "CAP-AUTHORIZATION", "percent": 150},
    {"capabilityId": "CAP-PLATFORM-FOUNDATION", "percent": 125},
    {"capabilityId": "CAP-LOWCODE-DEFINITION", "percent": 200},
    {"capabilityId": "CAP-RECORD-RUNTIME", "percent": 200},
    {"capabilityId": "CAP-FLOW", "percent": 250},
    {"capabilityId": "CAP-APPLICATION", "percent": 200},
    {"capabilityId": "CAP-WORK", "percent": 125},
    {"capabilityId": "CAP-NOTIFICATION", "percent": 125},
    {"capabilityId": "CAP-AI", "percent": 200},
    {"capabilityId": "CAP-DATA-EXCHANGE", "percent": 150},
    {"capabilityId": "CAP-ANALYTICS", "percent": 175},
    {"capabilityId": "CAP-UI-RUNTIME", "percent": 200},
    {"capabilityId": "CAP-OPERATIONS-SECURITY", "percent": 150}
  ],
  "taskEstimateOverrides": [
    {"taskId": "TASK-0009", "estimateMinutes": 90, "basis": "密码登录、会话轮换、失败限制和显式上下文已有真实实现；本任务只补已发布身份源选择、SSO 回调映射、MFA 级别和登录审计，不再混入身份源配置后台。"},
    {"taskId": "TASK-0010", "estimateMinutes": 45, "basis": "现有登录注册页面可修改复用，补已发布身份源入口、专属失败反馈和平台上下文展示。"},
    {"taskId": "TASK-0018", "estimateMinutes": 160, "basis": "按协议拆分身份源草稿、测试报告、不可变发布版本和密钥引用编排，单任务只负责平台后台后端闭环。"},
    {"taskId": "TASK-0019", "estimateMinutes": 120, "basis": "实现平台后台身份源协议专属表单、预检报告和发布结果读回。"},
    {"taskId": "TASK-0020", "estimateMinutes": 60, "basis": "从平台后台真实执行身份源草稿、预检失败与成功发布旅程。"},
    {"taskId": "TASK-0021", "estimateMinutes": 180, "basis": "实现系统继承、域名、部门员工账号成员映射、JIT/申请和登录日志后端闭环。"},
    {"taskId": "TASK-0022", "estimateMinutes": 120, "basis": "实现系统后台映射草稿、预检冲突、人工确认、同步结果和日志页面。"},
    {"taskId": "TASK-0023", "estimateMinutes": 75, "basis": "从系统后台真实执行继承、映射预检、同步和无成员失败旅程。"},
    {"taskId": "TASK-0025", "estimateMinutes": 50, "basis": "注册事务已能原子创建系统、主租户、成员和初始角色，需拆出独立创建系统用例并补完整生命周期。"},
    {"taskId": "TASK-0028", "estimateMinutes": 60, "basis": "已有系统设置与租户管理入口，但平台后台和系统后台固定配置仍需补全。"},
    {"taskId": "TASK-0031", "estimateMinutes": 50, "basis": "已有系统和租户进入会话，需增加域名对象、显式切换器和全壳缓存重绘。"},
    {"taskId": "TASK-0038", "estimateMinutes": 75, "basis": "现有角色正向授权和基础数据范围可修改复用，组织、字段、动作和版本发布仍不完整。"},
    {"taskId": "TASK-0048", "estimateMinutes": 45, "basis": "已有审计写入和查询端点，需增加字段前后值、保留、清理审批和脱敏。"},
    {"taskId": "TASK-0049", "estimateMinutes": 30, "basis": "已有审计列表视图可作为最终后台页面基础。"},
    {"taskId": "TASK-0052", "estimateMinutes": 30, "basis": "ApiResult、DomainException、异常处理和 traceId 已存在，需扩充域错误和契约边界。"},
    {"taskId": "TASK-0053", "estimateMinutes": 20, "basis": "前端 API envelope 和 traceId 错误显示可直接修改复用。"},
    {"taskId": "TASK-0066", "estimateMinutes": 60, "basis": "模块组、模块草稿、发布版本和运行目录已有真实实现，需扩充生命周期及最终元数据边界。"},
    {"taskId": "TASK-0067", "estimateMinutes": 50, "basis": "现有模块配置页面可复用交互骨架，需按最终模板分类和动作范围重组。"},
    {"taskId": "TASK-0075", "estimateMinutes": 60, "basis": "现有发布检查、不可变版本和回滚可修改复用，需增加所有配置组成和破坏性迁移检查。"},
    {"taskId": "TASK-0076", "estimateMinutes": 50, "basis": "现有发布检查与版本 UI 可修改复用。"},
    {"taskId": "TASK-0085", "estimateMinutes": 75, "basis": "通用记录新建编辑、字段值、参与人、权限范围和乐观锁已有实现，需补完整组成与历史。"},
    {"taskId": "TASK-0086", "estimateMinutes": 60, "basis": "现有发布 Schema 驱动列表表单详情可修改复用，但字段组件和可见结果仍需完善。"},
    {"taskId": "TASK-0177", "estimateMinutes": 180, "basis": "该任务只能在全部桌面功能完成后统一覆盖断点、触控、键盘和可访问性矩阵，不能分散重复实施。"},
    {"taskId": "TASK-0192", "estimateMinutes": 120, "basis": "基于已存在的 53 个视图和历史截图整理角色、工作空间、页面骨架及完成门禁。"},
    {"taskId": "TASK-0193", "estimateMinutes": 180, "basis": "需要统一两套样式入口、共享组件、页面骨架、状态和产品语言，但不改变业务 API。"},
    {"taskId": "TASK-0194", "estimateMinutes": 45, "basis": "抽取代表性页面执行视觉语义、文案、焦点和状态矩阵验收。"},
    {"taskId": "TASK-0195", "estimateMinutes": 180, "basis": "重构平台、系统运行态和后台三套壳的导航、上下文和返回关系。"},
    {"taskId": "TASK-0196", "estimateMinutes": 45, "basis": "按普通用户、系统管理员和平台管理员验证完整导航旅程。"},
    {"taskId": "TASK-0197", "estimateMinutes": 180, "basis": "平台和系统首页需要从验收卡片重组为真实任务、业务指标和继续入口。"},
    {"taskId": "TASK-0198", "estimateMinutes": 45, "basis": "使用真实权限与业务数据验证首页行动价值和失败状态。"},
    {"taskId": "TASK-0199", "estimateMinutes": 210, "basis": "列表、详情、表单、动作和移动卡片属于一条连续运行主链，需整体收敛操作密度。"},
    {"taskId": "TASK-0200", "estimateMinutes": 45, "basis": "桌面和移动各完成一次真实模块查询、编辑、详情及返回旅程。"},
    {"taskId": "TASK-0201", "estimateMinutes": 150, "basis": "固定后台能力已存在，重点重组目录、对象选择、编辑和结果反馈层级。"},
    {"taskId": "TASK-0202", "estimateMinutes": 45, "basis": "分别按平台管理员与系统管理员完成查找和保存配置旅程。"},
    {"taskId": "TASK-0203", "estimateMinutes": 180, "basis": "保留现有低代码能力与 API，重组五类模板任务及发布操作节奏。"},
    {"taskId": "TASK-0204", "estimateMinutes": 45, "basis": "从创建模块到发布运行执行真实配置和业务读回。"},
    {"taskId": "TASK-0205", "estimateMinutes": 180, "basis": "对 53 个视图统一执行文案、状态、空错加载、桌面移动和键盘收口。"},
    {"taskId": "TASK-0206", "estimateMinutes": 60, "basis": "最终按三角色和桌面平板移动矩阵验收，不再只按功能可点击判断。"}
  ],
  "taskPhaseOverrides": [
    {"taskId": "TASK-0177", "phaseId": "PHASE-06", "basis": "完整功能完成后统一执行响应式 hardening。"},
    {"taskId": "TASK-0178", "phaseId": "PHASE-06", "basis": "移动核心旅程验收属于最终 hardening。"},
    {"taskId": "TASK-0192", "phaseId": "PHASE-06", "basis": "历史功能完成后重新建立体验基线。"},
    {"taskId": "TASK-0193", "phaseId": "PHASE-06", "basis": "统一设计系统属于最终产品体验 hardening。"},
    {"taskId": "TASK-0194", "phaseId": "PHASE-06", "basis": "代表性页面体验验收属于最终 hardening。"},
    {"taskId": "TASK-0195", "phaseId": "PHASE-06", "basis": "全局壳和导航需在全部能力可用后统一重构。"},
    {"taskId": "TASK-0196", "phaseId": "PHASE-06", "basis": "三角色导航验收属于最终 hardening。"},
    {"taskId": "TASK-0197", "phaseId": "PHASE-06", "basis": "首页业务层级整改使用全部已完成能力和真实数据。"},
    {"taskId": "TASK-0198", "phaseId": "PHASE-06", "basis": "首页行动价值验收属于最终 hardening。"},
    {"taskId": "TASK-0199", "phaseId": "PHASE-06", "basis": "模块运行主链在全部字段动作能力完成后统一收敛。"},
    {"taskId": "TASK-0200", "phaseId": "PHASE-06", "basis": "模块主链桌面移动验收属于最终 hardening。"},
    {"taskId": "TASK-0201", "phaseId": "PHASE-06", "basis": "后台配置层级在全部固定能力完成后统一重构。"},
    {"taskId": "TASK-0202", "phaseId": "PHASE-06", "basis": "后台配置清晰度验收属于最终 hardening。"},
    {"taskId": "TASK-0203", "phaseId": "PHASE-06", "basis": "低代码配置台在完整功能完成后按真实流程重新组织。"},
    {"taskId": "TASK-0204", "phaseId": "PHASE-06", "basis": "低代码配置到运行体验验收属于最终 hardening。"},
    {"taskId": "TASK-0205", "phaseId": "PHASE-06", "basis": "全路由一致性与响应式收口属于最终 hardening。"},
    {"taskId": "TASK-0206", "phaseId": "PHASE-06", "basis": "最终产品体验门禁位于功能和工程验收之后。"}
  ],
  "existingImplementationAssessment": [
    {"path": "projects/unexamine/db/init", "treatment": "replace", "taskIds": ["TASK-0008", "TASK-0024", "TASK-0037", "TASK-0047", "TASK-0051", "TASK-0061", "TASK-0065", "TASK-0084", "TASK-0097", "TASK-0110", "TASK-0117", "TASK-0127", "TASK-0134", "TASK-0144", "TASK-0148", "TASK-0155", "TASK-0165", "TASK-0179"], "rationale": "现有 27 表只覆盖六个早期模块；其表义和约束可作输入，但必须由全部 184 条需求重建完整初始基线。"},
    {"path": "projects/unexamine/backend/src/main/java/**/base", "treatment": "replace", "taskIds": ["TASK-0006"], "rationale": "现有 108 个生成文件只对应 27 张初步表；完整 init.sql 就绪后一次全量重新生成，禁止手工修补。"},
    {"path": "projects/unexamine/backend/src/main/java/com/unique/unexamine/shared/manage", "treatment": "modify", "taskIds": ["TASK-0052", "TASK-0055", "TASK-0180"], "rationale": "统一响应、异常、traceId 和持久化配置可复用，错误域、缓存幂等和启动预检仍需补全。"},
    {"path": "projects/unexamine/backend/src/main/java/com/unique/unexamine/authentication/manage", "treatment": "modify", "taskIds": ["TASK-0009", "TASK-0012", "TASK-0015", "TASK-0018", "TASK-0021"], "rationale": "密码登录、刷新、退出和会话真实可用，但改密重置、MFA、SSO 登录、身份源发布、系统映射和访问申请仍需分任务完成。"},
    {"path": "projects/unexamine/backend/src/main/java/com/unique/unexamine/platform/manage", "treatment": "modify", "taskIds": ["TASK-0015", "TASK-0018", "TASK-0025"], "rationale": "默认管理员和注册建系统事务有测试基础，需补身份源平台配置、统一账号和独立创建系统生命周期。"},
    {"path": "projects/unexamine/backend/src/main/java/com/unique/unexamine/system/manage", "treatment": "modify", "taskIds": ["TASK-0021", "TASK-0025", "TASK-0028", "TASK-0031", "TASK-0034"], "rationale": "系统租户进入和基础设置可复用；身份映射、模式影响检查、迁移、回滚、域名和完整后台边界仍需补全。"},